Granite New York Generic,Aliza Jacobi,"Rerum consequatur quae excepturi quaerat maiores praesentium est et totam. Vel et soluta sit ut doloremque. Ratione et ab in doloremque. Laudantium pariatur eligendi. Consequuntur et reiciendis ex.
 Quam inventore blanditiis laboriosam reiciendis omnis id nulla. Ad magnam quibusdam et deserunt architecto. Voluptatem impedit aliquam laborum exercitationem molestias sed. Iste voluptatem iusto facere blanditiis voluptas totam. Illo ex reprehenderit cumque consequatur asperiores dolore. Eos aliquam et eum id quos est sit ut.
 Provident labore officiis quo quos blanditiis. Placeat corporis in ut. Similique quia ut aliquid nam sunt vel culpa. Omnis nesciunt dolor placeat quia nobis aut iste.",http://lorempixel.com/480/640/abstract/,29043,87538,86841,32210,48578,18745,http://elva.biz,http://aisha.com,https://michel.net,https://gust.biz,https://melyssa.info,http://kraig.info,https://jarod.biz,http://verda.biz,http://kayla.name,http://muhammad.biz,http://jailyn.name,http://brenden.com,https://daija.info,Fish,154,,"Corkery, Kling and White",Granite New York Generic,50657,99674,English,Direct Money Market Account,http://matteo.org
partnerships optical Incredible,Gordon Gulgowski,"Ducimus quasi et at quos enim. Quia modi voluptas laudantium ipsam est praesentium. Alias quae inventore excepturi cupiditate voluptatibus ea. Praesentium aperiam enim rem.
 Sed dolorum error assumenda aut nemo vel dolores saepe. Provident id vitae quisquam aliquid et cum. Ratione ut eos autem porro itaque excepturi.
 Consequatur quibusdam repudiandae officia voluptatibus praesentium minima laborum. Voluptatibus voluptatem aut eius. Eos voluptatem quisquam possimus. Iste sed optio distinctio ipsum dolore sint. Sit illum voluptas aliquid libero eveniet. Et autem consequatur rerum debitis quod consequatur debitis architecto rerum.",http://lorempixel.com/480/640/abstract/,49453,55849,41786,89458,75802,25249,http://carissa.com,http://tina.net,https://eugene.com,https://lea.org,https://drew.info,https://godfrey.com,http://audie.net,http://beatrice.net,http://elnora.biz,http://laurianne.info,https://rebeca.net,http://kennith.com,http://ole.org,cyan,162,,"Williamson, Feest and Hickle",partnerships optical Incredible,26175,27943,English,,
array Steel Identity,Miss Shanie Durgan,"Temporibus quia doloribus accusamus pariatur sed doloremque aut dignissimos. Quidem necessitatibus totam quo. Perspiciatis adipisci excepturi sit harum corrupti tempora.
 Voluptas sit beatae. Explicabo omnis pariatur reprehenderit recusandae asperiores perspiciatis necessitatibus omnis. Pariatur illum nisi quis est minima odio animi odio. Qui suscipit illo voluptas. Qui porro eum dolorem corrupti occaecati harum ipsam laudantium.
 Voluptatem aut eum non. Ut veritatis enim et vel ut blanditiis nesciunt ipsam aliquid. Quia enim perspiciatis natus molestiae qui ut officia quos odio. Ex molestias velit ex veritatis iure. Maxime possimus minima natus.",http://lorempixel.com/480/640/abstract/,67423,68655,4418,3077,42410,81644,https://marina.name,http://josue.org,https://damien.biz,http://mathias.net,https://ophelia.com,http://daphnee.biz,http://kennedi.org,https://diego.com,http://giovanny.biz,http://dorcas.biz,https://mary.net,https://kadin.info,https://elmer.com,Money Market Account,85,,Renner Group,array Steel Identity,37055,64095,English,,
orchestrate Swaziland monetize,Anastacio Cassin,"Facilis voluptas labore ipsum nemo ut. Qui quaerat quisquam quod dolorem incidunt iste exercitationem perspiciatis eligendi. Eaque rerum dicta velit voluptas doloribus recusandae id non. In dignissimos similique.
 Quis exercitationem quia odit debitis in quo omnis. Dignissimos cupiditate ut dolor est alias officia nobis autem. Sed asperiores temporibus unde repellendus unde reprehenderit. Officia omnis hic autem sint reiciendis nobis. Dolores eveniet ut sit temporibus voluptas sit deleniti. Aut facilis occaecati vero quo et et quis ut rerum.
 Facere et fugiat alias dolore ut et cumque facere. Autem dolore quos delectus aut suscipit quaerat sint voluptatem et. Blanditiis molestiae magni nesciunt non rerum vel et eos.",http://lorempixel.com/480/640/abstract/,26355,65811,58937,39633,18541,35989,https://daryl.org,https://maggie.org,http://candelario.name,http://monty.biz,https://ardella.org,https://bill.org,https://dedrick.org,https://jake.biz,http://sidney.com,https://general.net,https://jeromy.org,https://ben.org,http://michele.net,alarm,1617,,"Paucek, Nolan and Hodkiewicz",orchestrate Swaziland monetize,51823,82394,English,,
capacitor Savings Account gold,Marilie Conn,"Ad modi quia ut omnis modi sequi. Saepe perferendis doloribus consequatur quasi repellat veniam natus natus iure. Cumque aut omnis amet iste dolores. Porro hic rerum enim dolor nisi repellat.
 Excepturi debitis excepturi vel impedit tempora reiciendis corrupti est. Laboriosam magnam officiis non. At cumque et nihil. Doloribus et cupiditate itaque.
 Deleniti dolore quia sit veritatis. Amet corporis quam ea qui beatae vero saepe. Fuga a vel ducimus error recusandae.",http://lorempixel.com/480/640/abstract/,42040,59849,33121,73649,19603,23699,http://daphney.net,http://justyn.name,https://haylie.com,http://vicky.info,http://hester.com,http://francisca.org,http://bernadine.name,https://queenie.org,http://matt.org,http://alayna.org,https://rasheed.info,http://rodolfo.biz,https://johan.com,iterate,2993,,Trantow and Sons,capacitor Savings Account gold,59920,38582,English,,
e,http://lavonne.org,https://floyd.info,http://alexandro.org,http://edmond.net,Borders,85,,Barrows LLC,Orchestrator interface Cotton,19070,80763,English,Credit Card Account attitude,http://ila.net
