secondary Unbranded Granite Hat Soft,Toney Osinski I,"Inventore ut sequi qui autem pariatur dolorem. Iste vitae voluptatem non harum qui rerum at. Voluptas fugit et et fuga sapiente voluptatibus dolorum. Qui enim sint illo.
 Ratione rerum sint. Tenetur nihil fugiat nisi perferendis iure minima itaque id nisi. Et nihil soluta. Iste corrupti omnis reiciendis nesciunt.
 Fugit asperiores asperiores. Id est fuga quasi nostrum rerum cumque ullam. Voluptas alias illum non illo et fugiat cum.",http://lorempixel.com/480/640/abstract/,41155,13240,36887,36085,74766,79324,http://madilyn.net,https://jeramy.info,http://mark.name,http://cali.biz,http://alda.org,http://myrtie.net,https://eva.biz,https://chanel.biz,http://chester.org,http://antonietta.com,http://bernadette.info,http://samson.com,https://greyson.org,Steel,1194,,Wiegand and Sons,secondary Unbranded Granite Hat Soft,87572,62220,English,Personal Loan Account overriding,https://krystal.net
Table impactful indigo,Dr. Rowan Batz,"Voluptatem ut debitis. Incidunt tempore architecto quaerat. Tempora quasi ducimus praesentium minus eum id cum delectus magni.
 Id voluptatem recusandae. Nobis quaerat repellat est molestiae voluptate consequuntur laudantium. Vero placeat est mollitia expedita occaecati blanditiis aut vel. Quisquam et velit vitae quia unde.
 Sunt molestias maxime. Quidem cum eum sequi repellat qui voluptatum nulla deserunt. Tempore in fugit. Fugiat magnam adipisci ut veritatis quibusdam omnis inventore laudantium voluptatem. Libero dolorem eveniet temporibus sunt et amet sint.",http://lorempixel.com/480/640/abstract/,5885,23408,5955,69308,29717,20177,http://jillian.info,https://theodora.name,http://velda.name,http://darryl.biz,https://sanford.com,http://seamus.info,https://judd.info,http://nellie.name,https://samara.org,http://hildegard.info,https://casimir.info,http://westley.name,https://julia.info,Developer,945,,"Beahan, Bechtelar and Kassulke",Table impactful indigo,42799,33043,English,Pants orchestrate,https://stone.info
